{"asset_id":"pkg.strat.trend-breakout.v1","asset_version":"1.0.0","created_at":"2026-09-04T20:00:00Z","declared_permissions":["READ_MARKET_DATA","EMIT_ORDER_INTENT"],"disposition":"QUALIFIED_FOR_ISOLATED_INSTALL","manifest_hash":"4a5b6c7d8e9f0123456789abcdef0123456789abcdef0123456789abcdef0123","preview_id":"preview.pkg-trend-001","preview_schema_version":1,"resource_caps":{"filesystem_isolated":true,"max_cpu_percent":50,"max_memory_mb":4096},"rollback_snapshot_id":"snap.preinstall.001","untrusted_capabilities_detected":0}
